{
  "schema_version": 1,
  "course": {
    "id": "apush",
    "title": "AP United States History",
    "description": "A vertical-video APUSH course organized as units, chapters, lessons, and instructional scenes.",
    "academic_year": "2026-2027",
    "audience": "APUSH students preparing for class assessments and the AP exam"
  },
  "defaults": {
    "video": {
      "width": 1080,
      "height": 1920,
      "fps": 30,
      "transition_seconds": 0.2
    },
    "tts": {
      "engine": "edge",
      "edge_voice": "en-US-GuyNeural",
      "edge_rate": "+2%",
      "edge_pitch": "+0Hz"
    },
    "generation": {
      "provider": "none"
    },
    "clip_generation": {
      "provider": "meta-ui",
      "cookie": "C:/Users/munis/projects/sat_question_runner/new_eng_qs/config/meta_cookies/ramsham21.json",
      "lib_dir": "C:/Users/munis/projects/sat_question_runner/new_eng_qs/lib",
      "browser": "chrome",
      "timeout_seconds": 1200,
      "meta_refusal_retries": 2,
      "keep_open_on_failure": true
    },
    "presentation": {
      "audience": "APUSH students",
      "tone": "clear, analytical, and historically precise",
      "visual_style": "museum-documentary visuals with readable AP exam vocabulary",
      "captions": true,
      "music": "subtle instrumental bed below narration",
      "branding": "APUSH Unit 1"
    }
  },
  "units": [
    {
      "unit_id": "unit-1",
      "title": "Period 1: Worlds Before and After Contact",
      "period": "Period 1",
      "date_range": "1491-1607",
      "description": "Indigenous societies before European arrival, Atlantic exploration, the Columbian Exchange, and the first Spanish systems of conquest and labor.",
      "learning_objectives": [
        "Explain how geography shaped diverse Indigenous societies before European contact.",
        "Explain the causes and effects of European exploration in the Americas.",
        "Evaluate how the Columbian Exchange transformed societies on both sides of the Atlantic."
      ],
      "themes": [
        "American and National Identity",
        "Work, Exchange, and Technology",
        "Geography and the Environment",
        "Migration and Settlement"
      ],
      "chapters": [
        {
          "chapter_id": "u1-ch1",
          "title": "Native Societies and Atlantic Contact",
          "description": "A two-lesson chapter moving from Indigenous regional diversity to sustained Atlantic contact and exchange.",
          "essential_questions": [
            "How did environment shape societies in North America before 1492?",
            "Why did Atlantic contact produce unequal demographic, economic, and political consequences?"
          ],
          "learning_objectives": [
            "Compare Indigenous societies in at least two North American regions.",
            "Trace the motives and routes behind European exploration.",
            "Use historical evidence to explain the effects of biological and commercial exchange."
          ],
          "lessons": [
            {
              "lesson_id": "u1-ch1-l1-native-societies",
              "title": "North America Before European Contact",
              "description": "Regional diversity, environmental adaptation, exchange networks, and political organization before sustained European contact.",
              "essential_question": "How did geography and exchange shape diverse Indigenous societies before 1492?",
              "learning_objectives": [
                "Identify how climate and available resources influenced settlement and subsistence.",
                "Compare the social organization of societies in different regions.",
                "Explain why North America in 1491 cannot be described as a single culture."
              ],
              "key_terms": [
                {
                  "term": "maize agriculture",
                  "definition": "Cultivation of corn that supported population growth and settled communities."
                },
                {
                  "term": "Cahokia",
                  "definition": "A major Mississippian urban and ceremonial center near the Mississippi River."
                },
                {
                  "term": "regional diversity",
                  "definition": "Variation among societies produced by geography, resources, migration, and cultural choices."
                }
              ],
              "ap_alignment": {
                "topics": [
                  "1.1 Indigenous Societies Before European Contact"
                ],
                "skills": [
                  "Contextualization",
                  "Comparison",
                  "Causation"
                ]
              },
              "output": "../../build/lesson-videos/u1-ch1-l1-native-societies.mp4",
              "scenes": [
                {
                  "id": "many-americas",
                  "purpose": "hook",
                  "narration": {
                    "text": "North America in 1491 was not one society waiting to be discovered. [beat] Millions of people lived in distinct communities, spoke many languages, and built economies adapted to local environments. The useful starting point is [emphasis]diversity[/emphasis], not a single stereotype."
                  },
                  "visual": {
                    "base_image": "../../assets/images/u1/original-u1-native-01.jpg",
                    "clip": "../../video/ai_clips/u1-1491-maize-living.mp4"
                  },
                  "animation": {
                    "type": "ai_clip",
                    "prompt": "A living historical engraving of an agricultural field. Thin clouds drift across the sky; leaves and grasses stir in a light breeze; fine dust drifts over the tilled rows of maize and beans; patches of sunlight shift softly across the ground. Keep the camera static.",
                    "duration": 8,
                    "seed": 1491,
                    "provider": "meta-ui",
                    "fallback_provider": "ltx"
                  },
                  "beats": [
                    {
                      "type": "label",
                      "cue": "North America in 1491",
                      "duration": 3.2,
                      "text": "1491: MANY SOCIETIES, MANY ENVIRONMENTS",
                      "x": 0.5,
                      "y": 0.18
                    },
                    {
                      "type": "host",
                      "cue": "Millions of people",
                      "duration": 3.2,
                      "text": "Historian's rule: start with diversity",
                      "x": 0.5,
                      "y": 0.78
                    },
                    {
                      "type": "question",
                      "cue": "The useful starting point",
                      "duration": 3.8,
                      "text": "How did environment shape choices?",
                      "x": 0.5,
                      "y": 0.82
                    },
                    {
                      "type": "progress",
                      "at": 0.0,
                      "duration": 16.0,
                      "y": 0.94
                    }
                  ],
                  "audio": {
                    "effects": [
                      {
                        "cue": "North America in 1491",
                        "kind": "impact",
                        "volume": 0.25
                      },
                      {
                        "cue": "The useful starting point",
                        "kind": "chime",
                        "volume": 0.18
                      }
                    ]
                  },
                  "transition": {
                    "type": "dip_to_black",
                    "duration": 0.25
                  },
                  "min_duration": 10,
                  "topics": [
                    "1.1"
                  ],
                  "on_screen_text": [
                    "1491",
                    "Regional diversity",
                    "Environmental adaptation"
                  ],
                  "source": {
                    "title": "Historical depiction of Indigenous life",
                    "license": "Public domain",
                    "notes": "Use as historical evidence with attention to the creator's perspective."
                  },
                  "production_notes": "Open with the year 1491, then reveal the essential question beneath the title."
                },
                {
                  "id": "cahokia-network",
                  "purpose": "evidence",
                  "narration": {
                    "text": "Near the Mississippi River, [awed] Cahokia became a large urban center supported by maize agriculture. Its monumental earthworks and far-reaching trade connections demonstrate [emphasis]organized labor[/emphasis], political authority, and exchange networks that linked communities across long distances."
                  },
                  "visual": {
                    "base_image": "../../assets/images/u1/anim-cahokia-mound-1907.jpg",
                    "clip": "../../video/ai_clips/u1-cahokia-mound-living.mp4"
                  },
                  "animation": {
                    "type": "ai_clip",
                    "prompt": "An archival photograph of the Cahokia mound at rest. Thin layered clouds move slowly across the sky; foreground grasses ripple in a light breeze; long sunlight and tree shadows shift gently over the mound and fields. The photographic composition stays fixed. Do not add buildings or people or text or modern objects.",
                    "duration": 8,
                    "seed": 1051,
                    "provider": "meta-ui",
                    "fallback_provider": "ltx",
                    "caption": "Cahokia: agriculture, urbanism, and exchange"
                  },
                  "beats": [
                    {